Rank,Song,Artist,Year,Lyrics,Source,Label,Ownership
49,the groove line,heatwave,1978,pack your grip takin you on a trip aint no seats all we gots dancin feet leave you worries behind cause rain shine wont mind were ridin on the groove line tonight get this train know youll be glad you came hit the track party hard there and back leave you worries behind cause rain shine dont mind were ridin on the groove line tonight check out the wheels are turnin you know we wont stop we got this boiler burnin were keepin it hot so grab your friends get the train comin through climb on board where you leaves up to you leave you worries behind cause rain shine dont mind were ridin on the groove line tonight leave you worries behind cause rain shine dont mind were ridin on the groove line tonight check out the wheels are turnin you know we wont stop we got this boiler burnin were keepin it hot so grab your friends get the train comin through climb on board where you leaves up to you leave you worries behind cause rain shine dont mind were ridin on the groove line tonight cause rain shine dont mind were ridin on the groove line tonight rain shine dont mind were ridin on the groove line tonight grab your friends get the train comin through climb on board where you leaves up to you leave you worries behind cause rain shine dont mind were ridin on the groove line tonight cause rain shine dont mind were ridin on the groove line tonight cause rain shine dont mind were ridin on the groove line tonight cause rain shine dont mind were ridin on the groove line tonight cause rain shine dont mind were ridin on the groove line tonight cause rain shine dont mind were ridin on the groove line tonight,1,Party,Anusha
65,reminiscing,little river band,1978,friday night it was late i was walking you home we got down to the gate i was dreaming of the night would it turn out right how to tell you girl i want to build my world around you wanna tell you that its true i wanna make you understand im talking about a lifetime plan well thats the way it began we were handin hand glen millers band was better than before we yelled and screamed for more and those porters tunes made us dance across the room it ended all too soon on the way back home i promised youd never be alone hurry dont be late i cant hardly wait i said to myself when were old well go dancing in the dark walking through the park and reminiscing friday night it was late i was walking you home we got down to the gate i was dreaming of the night would it turn out right now as the years roll on each time we hear our favourite song the memories come along older times were missing spending the hours reminiscing,1,Party,Anusha
70,whats your name,lynyrd skynyrd,1978,well its eight oclock in boise idaho ill find my limo driver mister take us to the show i done made some plans for later on tonight ill find a little queen and i know i can treat her right whats your name little girl whats your name shootin you straight little girl wont you do the sameback at the hotel lord we got such a mess it seems that one of the crew had a go with one of the guests oh yes well the police said we cant drink in the bar what a shame wont you come upstairs girl and have a drink of champagne whats your name little girl whats your name shootin you straight little girl for there aint no shame whats your name little girl whats your name shootin you straight little girl wont you do the same awh yeah whats your name little girl whats your name shootin you straight little girl wont you do the samenine oclock the next day and im ready to go i got six hundred miles to ride to do one more show oh no can i get you a taxi home it sure was grand when i come back here next year i want to see you againwhat was your name little girl whats your name shootin you straight little girl well there aint no shame what was your name little girl whats your name shootin you straight little girl wont you do the same woo,1,Party,Anusha
85,get off,foxy,1978,ooh ooh ooh ooh ooh ooh ooh ooh ooooooohyeah get off music may ease and end all discretion so we can get off we keep under the sheets with two lovelys so we can get off said i hope that we get the promise ladies and make me get off take it from girls with our imagination so we can get offcall me up at your place i can love you crazy in the heat you will understand danger and excitement thats what makes a lady find out what she wants in a man to get off get off to get off to get off to get off to get off to get off to get get off ooh ooh ooh ooh ooh ooh ooh ooh ooh ooh ooh ooh ooh ooh ooh ooh ooooooohlookin through that dress that drive me crazy and makes me get off sensuality excites my mind it makes get off if i were you id get a good perspective on how to get off love me wild and love me crazy so we can get offcall me up at your place i can love you crazy in the heat you will understand danger and excitement thats what makes a lady find out what she wants in a man to get off to get off to get off to get off to get off to get off to get off to get get off ooh ooh ooh ooh ooh ooh ooh ooh ooooooohooh ooh ooh ooh ooh ooh ooh ooh ooh ooh ooh ooh ooh ooh ooh ooh ooooooohlookin through that dress that drive me crazy and makes me get off sensuality excites my mind it makes get off if i were you id get a good perspective for sure on how to get off love me wild and love me crazy so we can get offcall me up at your place i can love you crazy in the heat you will understand danger and excitement thats what makes a lady find out what she wants in a man to get off to get off to get off to get off to get off to get off to get off to get get off ooh ooh ooh ooh ooh ooh ooh ooh ooooooohget offso get off to get off to get off to get get off get off to get off to get off get off so get off get off to get off to get get off get off to get off get off get offto get off to get off to get off to get get off get off get off get off to get off get off to get off get off get get off get off get off so get off just get off get off get off get off,1,Party,Anusha
88,i love the nightlife,alicia bridges,1978,i love the nightlife i got to boogie on the disco round oh yeah oh i love the nightlife i got to boogie on the disco round oh yeah please dont talk about love tonight please dont talk about sweet love please dont talk about bein true and all the trouble weve been through ah please dont talk about all of the plans we had for fixin this broken romance i want to go where the people dance i want some action i want to live action i got so much to give i want to give it i want to get some too oh i oh i i love the nightlife i got to boogie on the disco round oh yeah oh i love the nightlife i got to boogie on the disco round oh yeah please dont talk about love tonight your sweet talkin wont make it right love and lies just bring me down when youve got women all over town you can love them all and when youre through maybe thatll make huh a man out of you i got to go where the people dance i want some action i want to live action i got so much to give i want to give it i want to get some too oh i i love the nightlife i got to boogie on the disco round oh yeah oh i love the night life i got to boogie on the disco round oh yeah oh i love the nightlife i got to boogie on the disco round yeah oh i love the night life i got to boogie on the disco round yeah oh i love the nightlife i got to boogie on the disco round oh yeah oh i love the night life i got to boogie on the disco round yeah oh i love the nightlife i got to boogie on the disco round oh yeah,3,Party,Anusha
92,flash light,parliament,1978,now i lay me down to sleep ooh i just cant find a beat flash light ohh i will never dance flash light flash light flash lightha da da dee da hada hada da daoh its no useflash light red light neon light ooh stop lightnow i lay me down to sleep i guess ill go count the sheep oh but i will never danceoh dont make me do it dance sucker ooh ha ha oww get himmost of all he needs the funk shine it help him find the funk ha funk it most of all he needs the funk help him find the funk get him most of all he needs the funk i know we can get him help him find the funk ho most of all he needs the funk ha dont help him find the funk i know you will dance sucker most of all he needs the funk shine the spotlight on him help him find the funk oh funk meha da da dee da hada hada da da dance nose you know you on my funk street oh funk me ha da da dee da hada hada da da get on down nose i like it dance thenflash light flash light oh ho ho spot light  spot light neon light neon light street light street lightoh ho ha haeverybodys got a little light under the sunshinin on the funk shinin on the funkmost of all he need the funk ha da da dee da hada hada da da help him find the funk most of all he need the funk help him find the funk most of all he need the funk help him find the funk most of all he need the funk help him find the funkha da da dee da hada hada da da oh flash light flash light flash light flash light flash light flash light flash light oh flash light flash light oh flash light spot light spot light neon light ooooh neon light flash light ooh flash light ho stop light stop light now i lay me down to sleep i guess ill go count the sheep ha da da dee da hada hada da da oh shake your funk ha da da dee da hada hada da da shake your funk ha da da dee da hada hada da da shake your rump ha da da dee da hada hada da da ho i think i found the funkflash light flash light day light day light spot light spot light red light ohhh hooo red light everybodys got a little light under the sunha da da dee da hada hada da da ha da da dee da hada hada da da ha da da dee da hada hada da da ha da da dee da hada hada da da ha da da dee da hada hada da da ha da da dee da hada hada da da ha da da dee da hada hada da da ha da da dee da hada hada da daeverybodys got a little light under the sun under the sun under the sun under the sun under the sun under the sun under the sun under the sun under the sun,1,Party,Anusha
1,my sharona,the knack,1979,ooh my little pretty one my pretty one when you gonna give me some time sharona ooh you make my motor run my motor run got it coming off o the line sharona never gonna stop give it up such a dirty mind i always get it up for the touch of the younger kind my my my aye aye whoa mmmmy sharona come a little closer huh awill ya huh close enough to look in my eyes sharona keeping it a mystery it gets to me running down the length of my thigh sharonanever gonna stop give it up such a dirty mind i always get it up for the touch of the younger kind my my my ayeaye whoa mmmmy sharona mmmmy sharona when you gonna give to me a gift to me is it just a matter of time sharona is it dddestiny ddestiny or is it just a game in my mind sharona never gonna stop give it up such a dirty mind i always get it up for the touch of the younger kind my my my aye aye whoa mmmmmmmmy my my aye aye whoa mmmmy sharona mmmmy sharona mmmmy sharona mmmmy sharona oooooooohhh my sharona oooooooohhh my sharona oooooooohhh my sharona,1,Party,Anusha
2,bad girls,donna summer,1979,bad girls talking about the sad girls sad girls talking about bad girls yeah see them out on the street at night walkin picking up on all kinds of strangers if the price is right you cant score if youre pockets tight but you want a good time you ask yourself who they are like everybody else they come from near and far bad girls talking about the sad girls sad girls talking about bad girls yeah friday night and the strip is hot suns gone down and theyre out to trot spirits high and legs look hot do you want to get down now dont you ask yourself who they are like everybody else they want to be a star bad girls sad girls youre such a dirty bad girl beep beep uh uh youre bad girl youre sad girl youre such a dirty bad girl beep beep uh uhnow you and me were both the same but you call yourself by different names now your mama wont like it when she finds out that her girl is out at nighthey mister have you got a dime mister do you want to spent some time oh yeah i got what you want you got what i need ill be your baby come and spend it on me hey mister i spend some time with youwith you with you bad girls bad girls talking aboud bad girls sad girlshey hey mister,1,Party,Anusha
3,le freak,chic,1979,ah freak out le freak cest chichave you heard about the new dance craze listen to us im sure youll be amazed big fun to be had by everyone its up to you it surely can be done young and old are doing it im told just one try and you too will be sold its called le freak theyre doing it night and day allow us well show you the wayah freak out le freak cest chic all that pressure got you down has your head spinning all around feel the rhythm check the ride come on along and have a real good time like the days of stopping at the savoy now we freak oh what a joy just come on down to fifty four find a spot out on the floorah freak out le freak cest chicnow freak i said freak now freak all that pressure got you down has your head spinning all around feel the rhythm check the ride come on along and have a real good time like the days of stopping at the savoy now we freak oh what a joy just come on down to fifty four find a spot out on the floor ah freak out le freak cest chic,1,Party,Anusha
31,shake your groove thing,peaches  herb,1979,theres nothing more that i like to do than take the floor and dance with you keep dancing lets keep dancing shake it shake it shake it shake it shake your groove thing shake your groove thing yeah yeah show em how to do it now shake your groove thing shake your groove thing yeah yeah show em how to do it now show em how to do it now lets show the world we can dance bad enough to strut my stuff the music gives us a chance we do more out on the floor grooving loose or heart to heart we put in motion every single part funky sounds wall to wall were bumping booties having us a ball you all shake your groove thing shake your groove thing yeah yeah show em how to do it now shake your groove thing shake your groove thing yeah yeah show em how to do it now weve got the rhythm tonight all the rest know were the best our shadows flash in the light twisting turning we keep burning shake it high or shake it low we take our bodies where they wanna go feel that beat never stop oh hold me tight spinning like a top shake your groove thing shake your groove thing yeah yeah show em how to do it now shake your groove thing shake your groove thing yeah yeah show em how to do it now theres nothing more that i like to do than take the floor and dance with you keep dancing lets keep dancing shake it shake it shake it shake it grooving loose or heart to heart we put in motion every single part funky sounds wall to wall were bumping booties having us a ball you all shake your groove thing shake your groove thing yeah yeah show em how to do it now shake your groove thing shake your groove thing yeah yeah show em how to do it now shake it show em how to do it now yeah shake it shake it shake it shake it shake your groove thing shake your groove thing show em how to do it now lets get on down show em how to do it now show em how to do it now show em how to do it now shake your groove thing shake it shake it shake it shake it pump up your booties now shake it shake it shake it shake it a little freakishness shake it shake it shake it shake it do it too you all,3,Party,Anusha
37,i was made for dancin,leif garrett,1979,you got me rollin like a wheel on the road turnin round and round nowhere to go ive got to find out if youre feeling it too its hard to tell so heres what i do and every time i want more ill take you out on the floori was made for dancin all all all all night long i was made for dancin all all all all night long the days and nights are moving by me and you youre such a crazy love you tear me in two i spend my time moving to dreams and a phase its a crazy love you can see it in my face and every time i want more ill take you out on the floor i was made for dancin all all all all night long yeah i was made for dancin all all all all night long i was made for dancin all all all all night long i was made for dancin all all all all night long ah hah dancin i was made for dancin ah hah i was made for dancin dancin dancin i was made for dancin all all all all night long yeah i was made for dancin all all all all night long oh i was made for dancin all all all all night long yeah,1,Party,Anusha
45,hes the greatest dancer,sister sledge,1979,oh what wow hes the greatest dancer oh what wow that ive ever seen oh what wow hes the greatest dancer oh what wow one night in a disco on the outskirts of frisco i was cruisin with my favorite gang the place was so borin filled with out of towners tourin i knew that it wasnt my thing i really wasnt carin but i felt my eyes starin at a guy who stuck out in the crowd he had the kind of body that would shame adonis and a face that would make any man proud oh what wow hes the greatest dancer oh what wow that ive ever seenoh what wow hes the greatest dancer oh what wowthe champion of dance his moves would put you in a trance and he never leaves the disco alone arrogance but not conceit as a man he is complete my crme de la crme please take me home he wears the finest clothes the best designers heaven knows ooo from his head down to his toes halston gucci fiorucci he looks like a still that man is dressed to kill oh what wow hes the greatest dancer oh what wow that ive ever seen ive ever seenoh what wow hes the greatest dancer oh what wowoh what wow hes the greatest dancer oh what wow that ive ever seen i love your moves oh what wow hes the greatest dancer oh what wow that ive ever seen oh what wow hes the greatest dancer oh what wow that ive ever seen ive ever seen oh what wow hes the greatest dancer oh what wowoh what wow hes the greatest dancer oh what wow that ive ever seen i love your movesoh what wow hes the greatest dancer oh what wow that ive ever seen,1,Party,Anusha
50,the devil went down to georgia,the charlie daniels band,1979,the devil went down to georgia he was lookin for a soul to steal he was in a bind cause he was way behind and he was willin to make a deal when he came across this young man sawin on a fiddle and playin it hot and the devil jumped up on a hickory stump and said boy let me tell you what i guess you didnt know it but im a fiddle player too and if you care to take a dare ill make a bet with you now you play a pretty good fiddle boy but give the devil his due ill bet a fiddle of gold against your soul cause i think im better than you the boy said my names johnny and it might be a sin but ill take your bet and youre gonna regret cause im the best theres ever been johnny rosin up your bow and play your fiddle hard cause hells broke loose in georgia and the devil deals the cards and if you win you get this shiny fiddle made of gold but if you lose the devil gets your soul the devil opened up his case and he said ill start this show and fire flew from his fingertips as he rosined up his bow then he pulled the bow across the strings and it made ansicevil hiss and a band of demons joined in and it sounded something like this when the devil finished johnny said well youre pretty good old son but just sit down in that chair right there and let me show you how its done he played fire on the mountain run boys run the devils in the house of the rising sun chicken in a bread pan picken at dough granny does your dog bite no child no the devil bowed his head because he knew that hed been beat and he laid that golden fiddle on the ground at johnnys feet johnny said devil just come on back if you ever wanna try again i done told you once you son of a bitch im the best theres ever been and he played fire on the mountain run boys run the devils in the house of the rising sun chicken in a bread pan picken at dough granny does your dog bite no child no,3,Party,Anusha
51,gold,john stewart,1979,when the lights go down in the california town people are in for the evenin i jump into my car and i throw in my guitar my heart beatin time with my breathin drivin over kanan singin to my soul theres people out there turnin music into gold well my buddy jim bass hes aworkin pumpin gas and he makes two fifty for an hour hes got rhythm in his hands as hes tappin on the cans sings rock and roll in the shower drivin over kanan singin to my soul theres people out there turnin music into gold ah the california girls are the greatest in the world each ones a song in the makin singin rock to me i can hear the melody the story is there for the takin drivin over kanan singin to my soul theres people out there turnin music into gold drivin over kanan singin to my soul theres people out there turnin music into gold when the lights go down in the california town people are in for the evenin i jump into my car and i throw in my guitar my heart beatin time with my breathin drivin over kanan singin to my soul theres people out there turnin music into gold flyin over kanan singin to my soul people out there turnin music into gold people out there turnin music into gold people out there turnin music into gold oh yeah people out there turnin music into gold into gold people out there turnin music into gold into gold people out there turnin music into gold into gold people out there turnin music into gold into gold people out there turnin music into gold into gold people out there turnin music into gold into gold people out there turnin music into gold into gold,3,Party,Anusha
54,rock n roll fantasy,bad company,1979,here comes the jesters one two three its all part of my fantasy i love the music and i love to see the crowd dancin in the aisles and singin out loudhere comes the dancers one bye one your mamas callin but youre havin fun you find youre dancin on a number nine cloud put your hands together now and sing it out loud its all part of my rock n roll fantasy its all part of my rock n roll dream its all part of my rock n roll fantasy its all part of my rock n roll dream put up the spotlights one and all and let the feelin get down to your soul the musics so loud you can hear the sound reachin for the sky and churn in up the ground,1,Party,Anusha
57,boogie wonderland,earth wind  fire  the emotions,1979,dance boogie wonderland hey hey dance boogie wonderland midnight creeps so slowly into hearts of men who need more than they get daylight deals a bad hand to a woman who has laid too many bets the mirror stares you in the face and says baby uh uh it dont work you say your prayers though you dont care you dance and shake the hurt dance boogie wonderland hey hey dance boogie wonderland sound fly through the night i chase my vinyl dreams to boogie wonderland i find romance when i start to dance in boogie wonderland i find romance when i start to dance in boogie wonderland all the love in the world cant be gone all the need to be loved cant be wrong all the records are playing and my heart keeps saying boogie wonderland wonderland dance boogie wonderland hey hey dance boogie wonderland hey hey i find romance when i start to dance in boogie wonderland i find romance when i start to dance in boogie wonderland dance boogie wonderland hey hey dance boogie wonderland hey hey wonderland wonderland all the love in the world cant be gone all the need to be loved cant be wrong all the records are playing and my heart keeps saying boogie wonderland wonderland dance boogie wonderland hey hey dance boogie wonderland hey hey i find romance when i start to dance in boogie wonderland i find romance when i start to dance in boogie wonderland dance boogie wonderland hey hey dance boogie wonderland hey hey,3,Party,Anusha
77,livin thing,electric light orchestra,1977,sailin away on the crest of a wave its like magic oh rollin and ridin and slippin and slidin its magic and you and your sweet desire you took me ohh higher and higher babyits a livin thing its a terrible thing to lose its a given thing what a terrible thing to lose im takin a dive making believe this is what youve conceived from your worst day im takin a dive oh moving in line when you look back in time to the first day im takin im takin and you and your sweet desire you took me dont you do it dont you do it ohh higher and higher baby its a livin thing its a terrible thing to lose its a given thing what a terrible thing to lose and im takin a dive ah the slide hey takin a dive cause you cant halt the slide floating downstream im takin a dive ah so let her go dont start spoiling the show its a bad dream im takin im takin and you and your sweet desire you took me dont you do it dont you do it ohh higher and higher babyits a livin thing its a terrible thing to lose its a given thing what a terrible thing to lose its a livin thing its a terrible thing to lose its a given thing what a terrible thing to lose,1,Happy,Anusha
78,give a little bit,supertramp,1977,give a little bit give a little bit of your love to me give a little bit ill give a little bit of my love to you theres so much that we need to share so send a smile and show that you care ill give a little bit ill give a little bit of my life for you so give a little bit give a little bit of your time to me see the man with the lonely eyes take his hand youll be so surprised give a little bit give a little bit of your love to me ill give a little bit of my life for you nows the time that we need to share so find yourself were on our way back home going home dont you need to feel at home oh yeah we gotta sing,1,Happy,Anusha
